{
  "$schema": "../contracts/build-profile.schema.json",
  "contractVersion": 1,
  "id": "windows-store",
  "product": {
    "name": "Quiltor",
    "applicationId": "app.quiltor.desktop"
  },
  "target": {
    "host": "desktop",
    "platform": "windows",
    "distribution": "microsoft-store",
    "architectures": ["x86_64", "arm64"]
  },
  "build": {
    "status": "scaffold",
    "artifact": "msix",
    "entrypoint": null,
    "smokeEntrypoint": null,
    "outputPattern": null
  },
  "security": {
    "sandbox": "package-identity",
    "signing": "store-managed",
    "entitlements": null
  },
  "capabilities": {
    "externalProcess": true,
    "codeDownload": false,
    "arbitraryFilesystem": true,
    "backgroundExecution": true
  },
  "updates": {
    "provider": "microsoft-store"
  },
  "release": {
    "channel": "store-production",
    "rolloutTrack": "public"
  },
  "publication": {
    "status": "scaffold",
    "channel": "microsoft-store",
    "storeListing": "distribution/store-listings/microsoft"
  }
}
